{
  "id": "intellij",
  "name": "IntelliJ Language Server",
  "description": "JetBrains IntelliJ Language Server",
  "url": "https://github.com/nicholasgasior/intellij-lsp",
  "initializationOptions": {
    "eulaHash": "34d850193ee04897"
  },
  "documentSelector": [
    {
      "language": "java"
    }
  ],
  "command": {
    "windows": "C:\\Users\\AngeloZerr\\.vscode\\extensions\\jetbrains.intellij-server-0.0.8-win32-x64\\server\\bin\\intellij-server.exe --stdio",
    "default": "intellij-server --stdio"
  }
}
